"title","task_title","note"
"Bucket List","Visit Big Sur",""
"Bucket List","Go back to school",""
"Bucket List","Visit the Sunken City","In San Pedro, California. There is this place called sunken city. Several decades ago, there was a landslide causing all the houses on the cliff to fall into the ocean. Now what’s left are ruins of roads, broken pipes, and beautiful graffiti art. Artists from the area have been entering this unknown place for years. Every inch of the ruins is covered in graffiti. If you love street art, this is the place for you. This place will give you the closest look at what a post apocalyptic world may look like. \n\nhttp://onecoolthingeveryweekend.com/2012/10/19/lost-sunken-city-in-san-pedro/"
"Bucket List","Go to Knott's Berry Farm","https://www.knotts.com"
"Bucket List","Bridge to Nowhere","Hike 5 miles to a bridge that literally was built in the middle of nowhere and connects nothing. As an added bonus you can bungee jump off of it.\n\nhttp://californiathroughmylens.com/2011/08/bridge-to-nowhere-azua-ca-photo/"
"Bucket List","Visit the Venice Canals","http://onecoolthingeveryweekend.com/2012/10/21/venice-canals-in-southern-california/"
"Bucket List","Murphy’s Ranch","Visit a ranch that was created for when the Nazi’s took over the United States. That obviously did not happen but this unique structure still stands.\nhttp://californiathroughmylens.com/murphys-ranch-abandoned-nazi-camp-in-santa-monica/"
"Bucket List","Learn to surf","Learn To Surf: It's never too late to rent a board and learn how to surf in San Diego. Summer is perfect for the first time surfer with small waves and warm water, just watch out for seasonal jellyfish and sting rays. Having lived in San Diego for 28 years, I have only been stung by a sting ray once so don't let that scare you. Book a surf lesson from one of the many shops in town (I recommend Ocean Beach Surf and Skate for quality kids surf and skate camps), rent a board and become the next Kelly Slater this summer in San Diego! - See more at: http://www.sandiego.com/san-diego-blog/last-minute-summer-bucket-list#sthash.jPPuH2qc.dpuf"
"Bucket List","Visit Santa Monica Pier","Santa Monica Pier\n321 Santa Monica Pier, Santa Monica, CA, United States"
"Bucket List","Madonna Inn","With no two rooms the same, a urinal fountain and massive pieces of cake there is a lot to love at this eclectic hotel.\n\nhttp://californiathroughmylens.com/madonna-inn"
"Bucket List","Hike Cowles Mountain","This heart pumping 3 mile vertical climb to the highest point within the city of San Diego. At 1,592 feet, the view from the top of Cowles Mountain makes the climb all the more worth it. \n\nhttp://www.sandiegohikers.com/Hiking-Trails/Cowles-Mountain.html\n\nCowles itself is an amateur hike with very few steep inclines but has always been a S.D. favorite due to the fact that it is the highest peak in the county. If you find yourself going up Cowles 2 or three times in order for a better workout, try hiking to Pyle's Peak instead. Once you find yourself atop Cowles, head towards the radio tower and you should immediately see a sign for Pyle's Peak. It adds about another 4 miles round trip to your hike and offers much steeper inclines than Cowles. And at the peak I find it to be an even better view than atop Cowles. I go to Cowles Mtn. often, and I hike Pyle's Peak every time. I'm surprised more people don't take advantage of it! Go check it out!!!"
"Bucket List","Mission Beach","Although a stroll down the boardwalk in Mission Beach is fun any time of year, it's especially entertaining during the summer months. Droves of tourists head to this popular beach community during summer to frolic, play beach volleyball and lay in the sand. People watching doesn't get any better than the Mission Beach boardwalk where you can catch a glimpse of locals and visitors interacting against the beautiful backdrop of the Pacific. Take a spin on the Giant Dipper at Belmont Park while you're at it for an adreneline rush just steps from the water. "
"Bucket List","Tios Tacos","http://californiathroughmylens.com/tios-tacos-riverside-art"
"Bucket List","Palomar Observatory","http://www.astro.caltech.edu/palomar/"
"Bucket List","Snorkeling/scuba dive","For fun or lobsters/spear fish\n\nSwim with Leopard Sharks in La Jolla Cove."
"Bucket List","Eat at Crazee Burger: Kangaroo, Gator & Buffalo Burgers","Ever wanted to eat alligator, kangaroo or antelope? You can do that here.\n\nhttp://californiathroughmylens.com/crazee-burger-kangaroo-gator-buffalo-burgers"
"Bucket List","Visit Venice Beach","Venice Beach\n1905 Ocean Front Walk, CA"
"Bucket List","Hotel del Coronado","\nCourtesy of the Hotel del Coronado\nTry a walking tour of the hotel and the surrounding neighborhoods in Coronado.\n\nWhat is your rating?\n\nHotel del Coronado\n1500 Orange Ave.\nCoronado\n800-468-3533\nwww.hoteldel.com\nType:  Monuments & Historic Sites, Neighborhoods & Districts\nThis famous Victorian resort on quaint Coronado Island—technically a peninsula, but it seems a world away—sits just across the bay from downtown. The hotel may be best known as the setting for Some Like It Hot, the classic Jack Lemmon-Tony Curtis-Marilyn Monroe film. Its lower-level hallways are filled with memorabilia from Charles Lindbergh, Charlie Chaplin and many of the hotel’s other famous guests. Try a walking tour of the hotel and the surrounding neighborhoods in Coronado. Tours are led by the local historical association.\n\nhttp://deltaskymag.delta.com/Destinations/San-Diego/Bucket-List/Hotel-del-Coronado.aspx"
"Bucket List","Gamble house",""
"Bucket List","self realization fellowship hermitage meditation gardens encinitas",""
"Bucket List","See San Diego Statiues","There is a couple amazing statues located right next to the USS Midway and they are fun to take pictures of and / or with. The first one is Unconditional Surrender by J. Seward Johnson and is a 25 foot tall statue of the famous image of a sailor kissing a nurse from WWII. It is really well done and is beautiful with the sunset or the USS Midway in the background.\n\nhttp://californiathroughmylens.com/2011/10/port-of-san-diego-statues-unconditional-surrender-bob-hope/"
"Bucket List","Torrey Pines State National Reserve","\nPhoto by Roger Isaacson\nA great place for a quiet, off-the-beaten-path hike.\n\nWhat is your rating?\n\nTorrey Pines State Natural Reserve\n12600 North Torrey Pines Road\nLa Jolla\n858-755-2063\nwww.torreypine.org\nHours:  Open daily at 8 a.m. Closing time is at sunset, which varies from 5 p.m. in the winter to 8 p.m. in the summer.\nPrice:  M-Th. $12, F-Su. and holidays $15\nType:  Nature Centers & Zoos\nGet your exercise fix at Torrey Pines State Natural Reserve, a great place for a quiet, off-the-beaten-path hike. The windswept cliffs are one of only two places in the U.S. where the rugged Torrey pine tree grows naturally (the other is Santa Rosa Island, off the coast 170 miles to the north). A perfect spot to enjoy a breathtaking sunset."
"Bucket List","Walk the Hollywood Walk of Fame (stars)","Hollywood Walk of Fame\n6801 Hollywood Boulevard, Los Angeles, CA 90028-6101"
"Bucket List","Gaviota Wind Caves","These caves overlooking Highway One, about 45 minutes North of Santa Barbara are a pretty crazy place for a hike. The wind has carved them over thousands of years.\n\nhttp://californiathroughmylens.com/gaviota-wind-caves"
"Bucket List","Elmer’s Bottle Trees Ranch","Elmer’s ranch is a great place to take pictures and admire the dozens of metal trees made with pole and bottles. I for one love this place\nhttp://californiathroughmylens.com/elmers-bottletree-ranch"
"Bucket List","Travel to at least  2 foreign countries","France\nEngland\nMarocco\nDominican Republic\nAustralia\nChina\nTibet\nUnited States (Hawaii, Alaska, Montana, Oregon, Florida)\n"
"Bucket List","how to revitalize a language","build website\nprovide free recording devices to people (e.g., $99 recorder, iPhone/phone software)\nprovide guided interview that lay people can use to capture diagnostic conversation (is the conversation of an endangered language)? \nuse address of recording sites to plot the location of the languages\ncite the person on the website \n  --> make the website competative\n  --> highlight top documenters\n  --> visit the very top people \n"
"Bucket List","#Print out social security form ","Gave to Vidya on 3/17\n"
"Bucket List","#Print for Priya ","Http://www.hubbardscupboard.com\n "
"Bucket List","FREE Custom Mother’s Day Card from Tiny Prints","FREE Custom Mother’s Day Card from Tiny Prints\n\nhttp://feedproxy.google.com/~r/KosherOnABudget/~3/EeFK6jntL7M/\n\nToday only, get a FREE Card for Mother’s Day from Treat.com (a division of Tiny Prints) when you use code MDAYFREE at checkout.\n\nShipping is free, too, if you have it sent to your home. If you want it sent directly to the recipient, you’ll pay just $.46, the cost of a stamp. And it’s guaranteed to arrive in time for Mother’s Day.\nThis offer is valid to new accounts with Treat.com only.\n\nSent by gReader"
"Bucket List","clean up Amazon","23 secrets\nscream for uncle\n\neasy ways to approach "
"Bucket List","Send More Productive Emails by Focusing on Actionable Subject Lines","Send More Productive Emails by Focusing on Actionable Subject Lines \n \nhttp://feeds.gawker.com/~r/lifehacker/full/~3/PmYHpvwj_Kw/send-more-productive-emails-by-focusing-on-actionable-s-493148336 \n \nEmail often turns into a deep pit of unanswered queries and unfinished tasks, and that's partly due to vague and un-actionable subject lines. As author Jason Womack points out, when your recipient doesn't know precisely what you want, you run the risk of ending up at the bottom of the pile. Here's what he suggests instead:Read more...     \n \nSent by gReader "
"Bucket List","Get 5 Lbs of FREE Shredding on Tax Day","http://www.officedepot.com/speciallinks/us/od/docs/taxcoupons_shredding.pdf"
"Bucket List","Free 8×10 Collage from Walgreens","Free 8×10 Collage from Walgreens\n\nhttp://feedproxy.google.com/~r/KosherOnABudget/~3/MhqIUeB_qCg/\n\nThru Saturday, May 11th, you can get a free 8×10 collage print from Walgreens when you use the coupon code COLLAGE4YOU at checkout.\nBe sure to select pick up at your local store to save on shipping, too — and get it in time for Mother’s Day!\n\nSent by gReader"
"Bucket List","Active Listening – How to Truly Listen","Active Listening – How to Truly Listen\n\nhttp://feedproxy.google.com/~r/LifeHack/~3/ljzY_D9Eci8/story01.htm\n\nDo you believe you a good listener and do others agree? If you don’t have that reputation, it’s not your fault: your brain is designed to predict what other people are going to say next. You are often so busy listening to your brain’s plotting and planning that you can’t hear what the other person is saying. A study conducted at Princeton University found that “speaker–listener neural coupling underlies successful communication”. If that was so much Greek to you, let’s state it more simply: when your brain starts acting like your conversational companion’s brain, you actually communicate. You won’t be surprised to hear that the study found there is generally a lag between what you hear and what you understand, and this is where we get into trouble. In the midst of that lag, we start predicting and supposing and guessing. Too often, we are still caught up in our own reverie as our conversation partner continues talking. The good doctors at Princeton would say that our brain activities decouple at that point and that as a result comprehension starts to plummet. This is the scientist’s way of saying, “You’re not listening.” Training Your Pet Brain The good news is that your brain works for you: rather than letting it just do what it’s programmed to do automatically, you can train it to do new tasks. The brain is the best pet you could ever hope for—it can be taught all kinds of tricks, and it loves to please its master. The trick to teaching your pet brain is concentration. Many folks find concentration to be taxing but that is because they approach it in the wrong way. While you can make yourself concentrate, sooner or later you will tire out and your brain will go back on autopilot. The result will be “neural decoupling”—that is, your brain will wander off on its own. Concentration is more properly approached passively rather than actively. Don’t make yourself concentrate; allow yourself to concentrate. Just hear what is said, observe the nonverbal cues like facial expressions and body language, absorb the tone and the pace of their speech. If you find you are distracted by other stimuli or by your own thoughts, be gentle with yourself. Just guide yourself back to hearing with no self-judgment. In fact, recognize that self-judgment itself is just another distracting thought. You will find with practice that these wanderings become less frequent. When you first attempt this, you will notice that you respond less quickly in conversation. People may not be used to you being this contemplative, so give them the chance to get used to it. Your responses will be more in tune with them, and everybody likes “in tune” better than “out of tune”. In short, they will feel heard by you like they have never felt it before. Brain Pattern Alignment If you do this, something fascinating happens, according to the doctors at Princeton. They did fMRI brain scans of the participants in their study and found that people’s brain wave patterns started to align as people actually listened. Not only did the lag between hearing and understanding vanish but the listeners started to anticipate what the other person was about to say before they said it. This is not the same as your autopilot guesses; instead, what they found is your brain pattern actually starts to match that of your partner in real time. When that happens, a strong connection occurs, understanding deepens between you, and real communication takes place. When you as the listener find yourself in the same state at the talker, you tend to move in tandem. People get a real charge out of being understood, so it is very much worth your effort to seek such an alignment. There is the practical benefit of receiving information as its imparter meant it to be received and additionally there is also an emotional connection that takes place. Even in mere business or transactional settings, there is value to such an emotional connection as it fosters trust and comfort. As a result, people believe in your sincerity and genuineness, which eases relations and lessens conflict. Your brain may not be so good at listening but that doesn’t mean you can’t be. Let it know who the boss is, and earn the reputation of being a good listener. Wouldn’t you like to have mind control over people? Wouldn’t it be great to have them do what you want?: The Secret to Getting People to Do What You Want The post Active Listening – How to Truly Listen appeared first on Lifehack.    \n\nSent by gReader "
"Bucket List","Call Atlas Cooling to get information for State Farm claims","http://www.evernote.com/shard/s2/sh/4e50b1fa-7ab5-4000-9a09-022045319844/7fa461f5caaf16980a1430e9e44f7b45"
"Bucket List","Jedi Mind Tricks: How to Get Loved Ones to Lose Weight","Jedi Mind Tricks: How to Get Loved Ones to Lose Weight \n \nhttp://www.fourhourworkweek.com/blog/2013/05/01/family-fat-loss-foodist/ \n \nDarya Pino Rose, PhD, and her dad, who transformed himself after years of resistance. \n“Families are like fudge: mostly sweet with a few nuts.” \n- Anonymous \n“Language is a means of getting an idea from my brain into yours without surgery.” \n- Mark Amidon \nLosing fat yourself is one thing. Readers of this blog have lost 100-200 pounds without too much trouble. \nGetting your mom or dad to take you seriously? To stop eating white bread or drinking 64-ounce sodas? That can seem impossible.  \nLoved ones — whether family, friends, boyfriends, girlfriends, spouses, or otherwise — can be sensitive. The people who need help most often won’t accept it, especially from those closest to them. \nSo what to do? \nThis post gives a real-world example from Darya Pino Rose, PhD.  I’ve known and followed Darya for years. Her PhD is in neuroscience from USCF, and she champions a whole-food-based approach to nutrition that avoids pills and powders. This combination produces fascinating results. \nThe below story, from her new book Foodist, shows exactly how she transformed her dad’s health without butting heads with him… and how you can do the same for your loved ones. \nDo you have any tricks that have worked with your family or friends? Please share in the comments! \nNote: For the purposes of this post, a “foodist” is someone who uses real food and real science to lose weight permanently. \nEnjoy… \nEnter Darya \nEating like a “foodist” does not doom you to being ostracized from your friends and family. This post will teach you how to lightheartedly deflect your critics and gently nudge (but not annoy) those loved ones you hope will adopt better eating habits.  \nThis is tricky business, but it can be done. \nHow To Win Over Friends and Influence Family \nIt’s hard to see loved ones suffer as a result of their eating habits. Traditional whole foods have been out of fashion for so long that many of our parents and sometimes even our grandparents are completely unaware of the negative health effects caused by the foods they grew up loving. As they age, however, these habits start to take their toll, and we must watch as their health deteriorates. A medical emergency that brings them face-to-face with reality is sometimes what it takes for them to make changes. Other times even that isn’t enough. \nUnfortunately, changing the habits of another person is even more difficult than changing your own. Stubbornness, pride, and ignorance can prevent people from even listening to advice that could save their lives, and for whatever reason age tends to compound these particular traits. Pushing a message that people don’t want to hear can cause them to dig in and fight even harder to preserve their way of life, straining and potentially destroying your relationship with them. When dealing with someone like this, it’s first essential to accept the fact that there may be nothing you can do for him or her. No matter how badly you may desire to help, a person has to want to change and cannot be forced. \nBut still, change can happen. Despite my close relationship with my father and his enthusiasm about my career path, I didn’t expect him to ever alter the way he ate. My dad had suffered from depression since I was in high school, and his outlook got even worse after my mother passed away in a car accident in 2003. Like most people, he had developed the habit of eating processed and fast foods starting in the early 1990s, and as his depression grew deeper, the effort he put into feeding and taking care of himself waned. \n“In general, I did not want to continue living and didn’t think I would. With all the health problems I was having, and especially after your mom died—that was a really hard thing for me to deal with—and I thought it would be better if I was gone too,” he told me. \nAfter a series of serious medical emergencies that nearly took his life on three occasions, I had nearly given up hoping for a turnaround, even though he was only in his fifties. But I continued to love him and share my passion for seasonal food whenever possible. \n“You were so understanding, you never put any pressure on me or tried to convince me to change, but you always gave me hope that things would get better, things would be better,” he recalled. \nFrom my perspective he had gone through enough and didn’t need me or anyone else telling him how to live out his life. If he didn’t want to live, I didn’t want to bug him about his blood pressure or eating habits. I just wanted to have as many happy and positive times with him as possible until whatever happened happened, and the last thing I wanted was to strain our relationship unnecessarily. I know my dad, and he is not one to do anything just because someone else, even me, thinks he should. Still my excitement about food and health was genuine, and I knew he had always been a fan of a good meal, so I continued to share what I was learning. \nMy cooking was the first thing that caught his attention. I made a point whenever visiting home in southern California to stop by the San Francisco farmers market before getting on the plane and bringing back something delicious. On one summer trip I brought home a small bag of padrón peppers, some good olive oil, and a crusty baguette. Padróns are small green peppers that are a common tapas dish in Spain and a seasonal delicacy for foodists in San Francisco. They are incredibly simple to prepare. All you have to do is heat some olive oil in a cast-iron pan and cook the peppers over medium heat until they blister and just start to brown. When they’re done, sprinkle them with some coarse sea salt and eat them with your fingers. Padróns have a deep pepper flavor, but are not usually spicy—except when they are. One out of every ten peppers is incredibly hot, so eating a bowl is a bit like playing Russian roulette with your tongue. \nMy dad has always been a fan of spicy foods, and I knew that padróns would be right up his alley. At his house I cooked them with a little more olive oil than usual, because it becomes infused with the oil from the peppers and tastes delicious. We used the bread to sop up the extra pepper oil and cool our mouths when we got burned on the spicy ones. My dad loved every bit of it and quietly started paying more attention whenever I mentioned food. \nHis next great epiphany was beets [ubersimple recipe at the end of this post]. All his life he had hated beets, and consequently I had never eaten them as a child. The first couple of times I tried them, even at nice restaurants, beets tasted a little off to me. Something about their flavor reminded me of dirt, and I could never get past that to enjoy their earthy sweetness. But I continued to sample them when they were available, hoping one day something would click. That day came one sunny afternoon at the house of a friend who was hosting a dinner party. We were having Dungeness crab for dinner, which I was totally excited about, but the main course was a long way off, so she put out a huge pile of roasted beets sprinkled with chèvre cheese and fresh mint as an appetizer. \nI was starving, so I started reluctantly picking at the giant pile with my fingers, since I didn’t want to scoop myself a serving of food I didn’t expect to like. I popped the first bite in my mouth and, yeah, it still tasted like beets. But I was hungry, so I tried another, this time with a good portion of mint and cheese on it. After a few chews, it hit me. “Whoa, this is good,” I said to myself. Something about the fresh-tasting mint and the creamy cheese balanced the earthy flavor of the beets and transformed them into something I could appreciate. I proceeded to put a hefty dent in the beet mountain, leaving bright pink stains all over my fingers. Beets had finally made it onto my beloved vegetables list, and I started making my own version of the recipe at home. \nProud of my recent conversion, I told my dad about my beet discovery during our next phone conversation. He replied skeptically, saying that he hated beets and always had. But I knew I was onto something and decided to include the recipe in our next Thanksgiving dinner, just so he could try it for himself. I made plenty of other dishes as well, just in case he really didn’t like the beets, but I followed my friend’s lead and set them out earlier than the rest of the food as an appetizer, knowing that someone with a hungry tummy couldn’t resist trying a bite. It worked. \n“When you made those beets I was like, ‘Wow, this is so unbelievable! So different from what I remember,’ ” he recalled. \nI was stoked, and my dad became a believer. At almost sixty years old, he developed a new appreciation for vegetables and real food (turns out the beets he grew up eating were always from a can), even the ones he thought he didn’t like. \n“It made eating and preparing healthy food much more fascinating,” he explained. “It became exciting to me to see what the possibilities are.” \nThe beets weren’t enough to change my dad’s habits, but he was starting to make the connection between good food and good health. More important, he was now convinced that vegetables and other healthy foods could taste amazing and that eating them would not be a sacrifice. He also began paying more attention to me and the things I would say and share on Facebook about the connections between food and wellness. \nThough he still didn’t care much about his own life or health, he was growing weary of feeling sick and drained all the time, and it was becoming obvious to him that his health (and possibly his diet) was the reason. After living for decades on processed foods, my dad had developed prediabetes and his blood sugar swings were having a terrible impact on his mood and energy levels. He also had dangerously high blood pressure, and in 2006 a mild stroke left him with a speech impediment tha"
"Bucket List","Visit all 50 states","http://www.amcharts.com/visited_states/#US-CT,US-DE,US-FL,US-IL,US-IN,US-KY,US-MA,US-MD,US-ME,US-MT,US-NC,US-NH,US-NJ,US-NY,US-OH,US-PA,US-RI,US-VT,US-WY"
"Bucket List","Hike in Utah","Arches National Park\nMoab, UT 84532\nhttp://www.yelp.com/biz/arches-national-park-moab\n\n\nArches National Park\nMoab, UT 84532\nhttp://www.yelp.com/biz/arches-national-park-moab"
